{
  "schema_version": 1,
  "package_id": "crypto-core",
  "sources": [
    {
      "path": "proofs/Keccak.v",
      "sha256": "231f8a2e9cc3f022e3647ef04d17a2e56fbb2b54ea7bcb10ae76d5caf52f4592"
    },
    {
      "path": "proofs/Sha256.v",
      "sha256": "2ff6dd7481b56fbb6dc6fc9267590e591ffe30bf07114fae8191319ace7aca0c"
    },
    {
      "path": "proofs/AesGcm.v",
      "sha256": "a1117410ed352177164d78f3f928339e499af6e55a38d6328eb3021af459988d"
    },
    {
      "path": "proofs/MlDsa.v",
      "sha256": "70d8785b066fdee5fe5461885ee17c2006e87b268519488505b19dbd87facac2"
    }
  ],
  "interfaces": [
    {
      "id": "storage-compartment",
      "source": {
        "path": "docs/implementation/contracts/boot-roster.md",
        "sha256": "5318560ee02aef72032063da50eb617c400f551c1faf38826a0dbc960cbb20ca"
      }
    },
    {
      "id": "storage-authentication",
      "source": {
        "path": "docs/implementation/storage-recovery-policy.md",
        "sha256": "e61f931a26788f94558e96a4fa45170a5ad2b5ab8e205e262d47ec5d5f205cd1"
      }
    }
  ],
  "handler_graph": null
}
